{"aggregation":{"accepted":false,"current_state":"blocked-dependencies","evidence_root_sha256":null,"uncertainty_blocks_acceptance":true},"authority":"offline-campaign-plan-and-state-machine-only","blockers":["S5_05_NOT_ACCEPTED","FRESH_EXACT_CAMPAIGN_APPROVAL_ABSENT","RC_BINDING_ABSENT"],"claims":{"campaign_authorized":false,"campaign_complete":false,"cloud_execution_observed":false,"production_ready":false,"release_eligible":false,"zero_resources_claimed":false},"dependencies":{"fresh_exact_campaign_approval":"absent-blocking","s5_05":"unmet-blocking"},"execution_route":{"cluster":false,"deployment":false,"external_model":false,"provider":false,"scheduler":false},"issue":369,"model_auth":{"api_key_only_required":true,"oauth":"disabled","real_model_execution":"not-authorized"},"phases":[{"evidence_binding_sha256":null,"execution":"unexecuted","phase":"exact-rc-conformance-real-dependencies","result":null},{"evidence_binding_sha256":null,"execution":"unexecuted","phase":"recovery-destructive","result":null},{"evidence_binding_sha256":null,"execution":"unexecuted","phase":"privacy-deletion-synthetic-sessions","result":null},{"evidence_binding_sha256":null,"execution":"unexecuted","phase":"cleanup-destroy","result":null},{"evidence_binding_sha256":null,"execution":"unexecuted","phase":"independent-zero-inventory","result":null}],"version":"cogs.stage5-campaign-plan/v1"}
